{
  "schema_version": 1,
  "name": "preview",
  "execution_scope": "preview",
  "workspace_id": "obs-notes-hub/reading-preview",
  "workspace": {
    "bucket": "obs-agent",
    "region": "oss-cn-beijing",
    "endpoint": "oss-cn-beijing.aliyuncs.com",
    "prefix": "reading/preview/",
    "credential_ref": "OSS_PREVIEW_CREDENTIALS",
    "versioning_verified": "unknown",
    "private_verified": false,
    "lifecycle_verified": false
  },
  "image": null,
  "target_repository": null,
  "github_app_credential_ref": null,
  "implementation_repository": "unirain/obs-auto-agent",
  "watchdog_credential_ref": null,
  "model_credential_ref": "DEEPSEEK_API_KEY",
  "model": "deepseek-flash",
  "cost_policy": "observe_only",
  "storage_limit_bytes": 50000000000,
  "cron_enabled": false,
  "enabled_at": null,
  "g5_evidence": null,
  "watchdog_repository": null,
  "model_provider": "deepseek",
  "model_base_url": "https://api.deepseek.com/anthropic"
}
